{"$schema":"https://json-schema.org/draft/2020-12/schema","type":"object","additionalProperties":false,"required":["schema_version","kind","release_eligible","entries"],"properties":{"schema_version":{"const":"v1"},"kind":{"const":"evidence-index"},"release_eligible":{"const":false},"entries":{"type":"array","items":{"type":"object","additionalProperties":false,"required":["id","task_id","component","result","release_eligible","evidence_hash","path"],"properties":{"id":{"type":"string","minLength":1},"task_id":{"type":"string","pattern":"^V2-[0-9]{3}$"},"component":{"type":"string","minLength":1},"result":{"enum":["passed","failed","partial"]},"release_eligible":{"const":false},"evidence_hash":{"type":"string","pattern":"^[a-f0-9]{64}$"},"path":{"type":"string","pattern":"^\\.agents/v2/evidence/[A-Za-z0-9._-]+\\.json$"}}}}}}
