{"schema_version": "v1", "kind": "evidence-index", "release_eligible": false, "entries": [{"id": "ev-v2-025-contracts", "task_id": "V2-025", "component": "contracts", "result": "passed", "release_eligible": false, "evidence_hash": "0cfbf68703a7d8a2068db675c4a7a61b73985ca2f8a9da9fbadcb57649ddc923", "path": ".agents/v2/evidence/V2-025-contracts.json"}, {"id": "ev-v2-008-candidate-aggregate", "task_id": "V2-008", "component": "candidate-aggregate", "result": "passed", "release_eligible": false, "evidence_hash": "fa7f11b8b679ac186f9562cbedd400a369cfda0e2e08b437b2c3f98f3aa3803c", "path": ".agents/v2/evidence/V2-008-candidate-aggregate.json"}, {"id": "ev-v2-041-secrets-gate", "task_id": "V2-041", "component": "environment", "result": "passed", "release_eligible": false, "evidence_hash": "573976fefeab64bc3a74284347415830cedc0888e01db990731ec70631861d79", "path": ".agents/v2/evidence/V2-041-secrets-gate.json"}, {"id": "ev-v2-009-release-contract", "task_id": "V2-040", "component": "release", "result": "passed", "release_eligible": false, "evidence_hash": "0af50161d1b2c35b035fb1218281d141f83ece055794c79a7c2c851ef4c2ec12", "path": ".agents/v2/evidence/V2-009-release-contract.json"}, {"id": "ev-v2-040-candidate-aggregate", "task_id": "V2-040", "component": "candidate-aggregate", "result": "passed", "release_eligible": false, "evidence_hash": "2510477325350143e55f8e2b6b8b6deca8d9e0b0e95dd49826adfed3c448d754", "path": ".agents/v2/evidence/V2-040-candidate-aggregate.json"}, {"id": "ev-v2-042-ledger-digest-allowlist", "task_id": "V2-042", "component": "environment", "result": "passed", "release_eligible": false, "evidence_hash": "fcd98dc7d1ff8b9f0edf5ea033e8b338ee62fdb4f606c046932d9786224205b7", "path": ".agents/v2/evidence/V2-042-ledger-digest-allowlist.json"}, {"id": "ev-v2-010-domain", "task_id": "V2-010", "component": "domain", "result": "passed", "release_eligible": false, "evidence_hash": "462086c7b408cd0ea978074efe455c347b3ed289a3e494f0b34d562416f0e14d", "path": ".agents/v2/evidence/V2-010-domain.json"}, {"id": "ev-v2-043-docs-alignment", "task_id": "V2-043", "component": "docs", "result": "passed", "release_eligible": false, "evidence_hash": "ecb46bf7401749a33fc4f300f0ac8d663fbda176291aa63ee2e3cbed3934c8d3", "path": ".agents/v2/evidence/V2-043-docs-alignment.json"}, {"id": "ev-v2-013-infra-plan", "task_id": "V2-013", "component": "infra-plan", "result": "passed", "release_eligible": false, "evidence_hash": "e57cae88d4b4be7fa52e9ae19d1784516cb1a4844107c46fe7d80a716c1be1f3", "path": ".agents/v2/evidence/V2-013-infra-plan.json"}, {"id": "ev-v2-016-runner", "task_id": "V2-016", "component": "runner", "result": "passed", "release_eligible": false, "evidence_hash": "ef178e1e6f2ebdaa23ec8638280646b502658d471aa901007c32fd8ddb30d8c5", "path": ".agents/v2/evidence/V2-016-runner.json"}, {"id": "ev-v2-044-runner-store-docs", "task_id": "V2-044", "component": "docs", "result": "passed", "release_eligible": false, "evidence_hash": "c9c7cdb3814ec18dfb5c1c1d58b391f9ac719fc0a028e08653755f5640bee7d0", "path": ".agents/v2/evidence/V2-044-runner-store-docs.json"}, {"id": "ev-v2-021-release", "task_id": "V2-021", "component": "release", "result": "passed", "release_eligible": false, "evidence_hash": "0f6d3618b5414642524827db4bb33dce82a40fbff61f20dafa98fa4041afea86", "path": ".agents/v2/evidence/V2-021-release.json"}, {"id": "ev-v2-047-provider-preflight-contract", "task_id": "V2-047", "component": "contracts", "result": "passed", "release_eligible": false, "evidence_hash": "adbbb63066ebcfcace9f3d53d5e021a7a49a3d612ffb8b5506bd679d9cc4c6dd", "path": ".agents/v2/evidence/V2-047-provider-preflight-contract.json"}, {"id": "ev-v2-048-execution-identifier", "task_id": "V2-048", "component": "docs", "result": "passed", "release_eligible": false, "evidence_hash": "f345c33a77117c84c563589442678113b4adde54ef2fdbfe77ea0aab9b6be093", "path": ".agents/v2/evidence/V2-048-execution-identifier.json"}, {"id": "ev-v2-019-reconciler", "task_id": "V2-019", "component": "reconciler", "result": "passed", "release_eligible": false, "evidence_hash": "693b4ea93f8160c111e6461fcd97f5414056c8b3942e5f5e92ca2b567014fdd5", "path": ".agents/v2/evidence/V2-019-reconciler.json"}, {"id": "ev-v2-049-failure-taxonomy", "task_id": "V2-049", "component": "domain", "result": "passed", "release_eligible": false, "evidence_hash": "40b83f11cc81b68a3551c48f98b117d894c6c260a5c1593e88f4db70409ee536", "path": ".agents/v2/evidence/V2-049-failure-taxonomy.json"}, {"id": "ev-v2-050-runaway-guard", "task_id": "V2-050", "component": "contracts", "result": "passed", "release_eligible": false, "evidence_hash": "b06700e4f2f36846d154e7a2878e7b13a4684a0867a2153c0b70a0544045ebc0", "path": ".agents/v2/evidence/V2-050-runaway-guard.json"}, {"id": "ev-v2-053-scope-documents", "task_id": "V2-053", "component": "docs", "result": "passed", "release_eligible": false, "evidence_hash": "3bb49b76c9f39880eb4e8701a84f44310acb936534806b0e2547dd4b120d9786", "path": ".agents/v2/evidence/V2-053-scope-documents.json"}, {"id": "ev-v2-055-standing-authorization", "task_id": "V2-055", "component": "internal-contracts", "result": "passed", "release_eligible": false, "evidence_hash": "1c638cc599d910f5bbbc99445d937171b33965eeeb6b48f5e3f1c5b29ecfd996", "path": ".agents/v2/evidence/V2-055-standing-authorization.json"}, {"id": "ev-v2-046-workspace-confinement", "task_id": "V2-046", "component": "runner", "result": "passed", "release_eligible": false, "evidence_hash": "47770f258f9e7a13eb82623a61e2842da30d4cc61b7c472641cd6d270fdcb901", "path": ".agents/v2/evidence/V2-046-workspace-confinement.json"}, {"id": "ev-v2-057-reconciler-refresh", "task_id": "V2-057", "component": "reconciler", "result": "passed", "release_eligible": false, "evidence_hash": "5cc440b9b96a3e7db1a45a44e1addaec628f6540ccb07c4cf08726f8d10e11a8", "path": ".agents/v2/evidence/V2-057-reconciler-refresh.json"}, {"id": "ev-v2-051-control-plane-local-live", "task_id": "V2-051", "component": "control-plane-local-live", "result": "passed", "release_eligible": false, "evidence_hash": "324a7dfdda9162e58fe47c20685894e90b0c04408c66fb06129cac6d8c5a9e33", "path": ".agents/v2/evidence/V2-051-control-plane-local-live.json"}, {"id": "ev-v2-052-requested-by", "task_id": "V2-052", "component": "application", "result": "passed", "release_eligible": false, "evidence_hash": "59457b1ebea2b605d9178fce6cfa8e3ac7d2936b4d62e1a176d5b881fe72a5ef", "path": ".agents/v2/evidence/V2-052-requested-by.json"}, {"id": "ev-v2-060-infra-plan-refresh", "task_id": "V2-060", "component": "infra", "result": "passed", "release_eligible": false, "evidence_hash": "de39f3be645eccc6246122db497b8f2ff987c43b57f8a29a8a0d510444b96d88", "path": ".agents/v2/evidence/V2-060-infra-plan-refresh.json"}, {"id": "ev-v2-060-control-plane-local-live-refresh", "task_id": "V2-060", "component": "control-plane-local-live", "result": "passed", "release_eligible": false, "evidence_hash": "e2771a9d71b702ae1027c802e959a27bb6e96c25f13621dcd7ecbe7d5fcba6c3", "path": ".agents/v2/evidence/V2-060-control-plane-local-live-refresh.json"}, {"id": "ev-v2-017-provider-live-claude", "task_id": "V2-017", "component": "provider-live-claude", "result": "partial", "release_eligible": false, "evidence_hash": "1a192fc8e9f974df3c38fd83c037683479f9a0fadaf288c478d4337ff2c7ce94", "path": ".agents/v2/evidence/V2-017-provider-live-claude.json"}, {"id": "ev-v2-062-ledger-boundary", "task_id": "V2-062", "component": "docs", "result": "passed", "release_eligible": false, "evidence_hash": "38fcc47fe96fd041c0556073563dc1980b477a2bd15269a7cbb7ddc33b966141", "path": ".agents/v2/evidence/V2-062-ledger-boundary.json"}, {"id": "ev-v2-059-docs", "task_id": "V2-059", "component": "docs", "result": "passed", "release_eligible": false, "evidence_hash": "2307f3ae09c37571d7412ffbeef6b55f07dfd9fdd97345b6a2a5b2e6cdf88e97", "path": ".agents/v2/evidence/V2-059-docs.json"}, {"id": "ev-v2-059-application", "task_id": "V2-059", "component": "application", "result": "passed", "release_eligible": false, "evidence_hash": "eedfabaf50e4f6ac30e218be90defba64970dd043b9faf9b111ef0ec84dd6a68", "path": ".agents/v2/evidence/V2-059-application.json"}, {"id": "ev-v2-030-scheduler", "task_id": "V2-030", "component": "scheduler", "result": "partial", "release_eligible": false, "evidence_hash": "66b1ac3375d130ba7c7860141a131489e4ea8d555b41fc95f035a62f2326340f", "path": ".agents/v2/evidence/V2-030-scheduler.json"}, {"id": "ev-v2-058-application", "task_id": "V2-058", "component": "application", "result": "partial", "release_eligible": false, "evidence_hash": "ee3a6618837848f816d2341087b82633e19165090e1a479e866d05eafcc3f10c", "path": ".agents/v2/evidence/V2-058-application.json"}, {"id": "ev-v2-058-runner", "task_id": "V2-058", "component": "runner", "result": "partial", "release_eligible": false, "evidence_hash": "23fdcba94758b9087896e0fb978ccb174e701c48bfba7e952586dd8efcf9f8f7", "path": ".agents/v2/evidence/V2-058-runner.json"}, {"id": "ev-v2-033-update", "task_id": "V2-033", "component": "update", "result": "passed", "release_eligible": false, "evidence_hash": "e7c767edec478b9deaa0199226f7187e446b147e78fcc8e2da49614df6dce3e7", "path": ".agents/v2/evidence/V2-033-update.json"}, {"id": "ev-v2-045-api", "task_id": "V2-045", "component": "api", "result": "passed", "release_eligible": false, "evidence_hash": "cc9e2d7a0225e6a628d82ad8acad2f29cb75bf1749c3bf9d7f096f15e242a6ba", "path": ".agents/v2/evidence/V2-045-api.json"}, {"id": "ev-v2-045-application", "task_id": "V2-045", "component": "application", "result": "passed", "release_eligible": false, "evidence_hash": "9be2cec7c3a559481d05cf65c26a30963f1764f7fd6b505a12dff59e7064a561", "path": ".agents/v2/evidence/V2-045-application.json"}, {"id": "ev-v2-045-candidate-aggregate", "task_id": "V2-045", "component": "candidate-aggregate", "result": "passed", "release_eligible": false, "evidence_hash": "a94bafaac4a0c86b488f4602eca00d7e40393c76498522741c8d0f39b3e3f817", "path": ".agents/v2/evidence/V2-045-candidate-aggregate.json"}, {"id": "ev-